{
  "projectName": "shepherd-acceptance-playground",
  "localUrl": "http://localhost:3055",
  "language": "typescript",
  "framework": "nextjs",
  "database": "unknown",
  "stackProfile": "nextjs",
  "authMode": "detected-or-human-confirmed",
  "skipDeployment": true,
  "buildAgent": "claude",
  "buildModel": "claude-opus-4-8",
  "buildRole": "implementer",
  "qaAgent": "codex",
  "qaModel": "gpt-5.5",
  "qaReasoningEffort": "medium",
  "qaRole": "reviewer",
  "architectureAgent": "codex",
  "architectureModel": "gpt-5.5",
  "architectureReasoningEffort": "medium",
  "reasoningEffort": "medium",
  "browserAgent": "agent-browser",
  "maxBudget": 0
}
